{
  "ceeline_version": "1.0",
  "envelope_id": "cel:fixture-reflection-001",
  "surface": "reflection",
  "channel": "internal",
  "intent": "reflection.self-critique",
  "source": {
    "kind": "agent",
    "name": "ceeline.fixtures",
    "instance": "reflection.self-critique",
    "timestamp": "2026-04-11T18:05:00Z"
  },
  "constraints": {
    "mode": "advisory",
    "audience": "machine",
    "max_render_tokens": 80,
    "no_user_visible_output": true,
    "fallback": "reject"
  },
  "preserve": {
    "tokens": [],
    "classes": []
  },
  "payload": {
    "summary": "Agent critiques its previous response for logical consistency.",
    "facts": [
      "Prior response assumed file existed without verification.",
      "Confidence was overestimated given missing context."
    ],
    "ask": "Revise approach to verify assumptions first.",
    "reflection_type": "self_critique",
    "confidence": 0.65,
    "revision": "Add file existence check before proceeding with edit.",
    "artifacts": [],
    "metadata": {
      "prior_action": "edit_file"
    }
  },
  "render": {
    "style": "none",
    "locale": "en",
    "sanitizer": "strict"
  }
}
